{
    "$schema": "https://schemas.company.com/security/tls-encryption.json",
    "protocol": "TLS",
    "version": "1.3",
    "cipher-suites": [
        "TLS_AES_256_GCM_SHA384",
        "TLS_CHACHA20_POLY1305_SHA256"
    ],
    "certificate-authority": "Internal-CA",
    "cert-rotation-days": 90
}
